crypto_name,source,url,id,title,published_date,summary,upvotes,comment_count
Bitcoin,reddit.com,https://www.newsbtc.com/news/bitcoin/bitcoin-price-easily-double-short-time-hedge-fund-ceo/?utm_source=coingecko&utm_content=coingecko&utm_campaign=coingecko&utm_medium=coingecko&utm_term=coingecko,1h64t5y,Bitcoin Could 'Easily Double' In A Short Time: Hedge Fund CEO,2024-12-04 01:58:37.000000,https://www.newsbtc.com/news/bitcoin/bitcoin-price-easily-double-short-time-hedge-fund-ceo/?utm_source=coingecko&utm_content=coingecko&utm_campaign=coingecko&utm_medium=coingecko&utm_term=coingecko,4,9
Bitcoin,reddit.com,https://www.reddit.com/r/CryptoCurrency/comments/1h64n7d/will_crypto_die_out/,1h64n7d,Will Crypto Die Out?,2024-12-04 01:50:13.000000,"Hello, I don't know too much about crypto, I'm a student so I don't have any money to invest anyways, but I'm curious.

I was wondering if crypto actually had any practical uses that are implemented in this day and age. For me and where I live almost no one has crypto or uses it on anything, the ones ik who have it just have it as an investment, but im curious if it has any uses in your countries, and if its just a problem here.

I know crypto has been on a rise lately and bitcoin is almost at 100k now, but my thoughts are if crypto has no uses anywhere that I can't imagine it being there decades or so from now, it might not die anytime soon but still. On the other hand if it is being used in other parts of the world I can see it surviving and continuing to thrive.


EDIT: Just to clarify im just looking for a reason why crypto will be relevant in a few decades. For example do you imagine crypto will be there in 40 years? If so, why? And how would you imagine it will look like in that time?",0,58
Bitcoin,reddit.com,https://www.coindesk.com/tech/2024/12/02/bitcoin-gets-a-decentralized-exchange-as-cosmos-native-osmosis-activates-bridge,1h61srv,Osmosis DEX activates BTC bridge enabling direct deposits & withdrawals of Bitcoin from wallets or Exchanges ,2024-12-03 23:39:06.000000,https://www.coindesk.com/tech/2024/12/02/bitcoin-gets-a-decentralized-exchange-as-cosmos-native-osmosis-activates-bridge,7,7
Bitcoin,reddit.com,https://www.bbc.com/news/articles/c77jx4d5748o,1h602ue,Bitcoin man sues Newport council over '£600m fortune lost in tip',2024-12-03 22:24:49.000000,https://www.bbc.com/news/articles/c77jx4d5748o,12,38
Bitcoin,reddit.com,https://www.bnnbloomberg.ca/business/international/2024/12/03/bitcoin-gets-briefly-caught-up-in-south-korean-political-strife/,1h5xivn,Bitcoin Gets Briefly Caught Up in South Korean Political Strife,2024-12-03 20:39:10.000000,https://www.bnnbloomberg.ca/business/international/2024/12/03/bitcoin-gets-briefly-caught-up-in-south-korean-political-strife/,8,2
Bitcoin,reddit.com,https://www.reddit.com/r/CryptoCurrency/comments/1h5vgzn/free_50_in_bitcoin_for_new_us_mobile_clients_on/,1h5vgzn,Free $50 in Bitcoin for new US mobile clients on Kraken,2024-12-03 19:17:04.000000,"&#x200B;

https://preview.redd.it/0fw0reh0oo4e1.png?width=3200&format=png&auto=webp&s=f29482e4d738c602f3c2c8c82897fc9db1036c7e

There’s never been better a time to join Kraken...

1. Sign up at [https://www.kraken.com/getbtc-reddit-social](https://www.kraken.com/getbtc-reddit-social)  use code “us50”
2. Deposit $25+ via Plaid and trade $10 or more
3. Get your free $50 in $BTC within 30 days

Only available in the Kraken mobile app to new US clients only. Limited to the first 20k clients. T&Cs apply.

Get all the details: [https://support.kraken.com/hc/en-us/articles/sign-up-offer-faq](https://support.kraken.com/hc/en-us/articles/sign-up-offer-faq)",0,46
Bitcoin,reddit.com,https://cryptobriefing.com/bitcoin-market-volatility-south-korea/,1h5upwo,"Bitcoin crashes to $62,000 on Upbit after South Korea enacts emergency martial law",2024-12-03 18:46:11.000000,https://cryptobriefing.com/bitcoin-market-volatility-south-korea/,736,98
Bitcoin,reddit.com,https://i.redd.it/k521xd8l8o4e1.png,1h5tbww,Brian Armstrong (Coinbase CEO) Says that US Government Should Never Sell Bitcoin (BTC),2024-12-03 17:49:16.000000,https://i.redd.it/k521xd8l8o4e1.png,279,77
Bitcoin,reddit.com,https://www.reddit.com/r/CryptoCurrency/comments/1h5r2gk/since_may_2023_bitcoincash_contracts_have_been/,1h5r2gk,"Since May 2023, BitcoinCash contracts have been able to implement: zk-SNARKs, STARKs...",2024-12-03 16:14:02.000000,"... , BLS signatures, Lamport signatures & hash-based signature schemes, post-quantum cryptography, verifiable delay functions, bulletproofs, ring signatures, confidential transactions (within covenants), homomorphic encryption, multi-party computation, and any other cryptosystem being implemented on or in any other cryptocurrency.

BitcoinCash's May 2023 upgrade allowed computations to be split across inputs and/or transactions, so even without further upgrades, it is already possible to perform any kind of computation within BitcoinCash contracts.

https://x.com/bitjson/status/1863974326028161264",0,2
Bitcoin,reddit.com,https://www.reddit.com/r/CryptoCurrency/comments/1h5pwzv/france_proposes_tax_on_unrealised_gains_for/,1h5pwzv,"France Proposes Tax on Unrealised Gains for Digital Assets and ""Non-Productive Assets""",2024-12-03 15:25:04.000000,"The French Senate recently had a debate with a proposal to replace the existing real estate wealth tax with a broader - and I quote - “unproductive wealth tax” targeting assets deemed inactive or underutilized. This includes unused real estate, luxury goods, and digital assets (they used BTC as an example - many times)

This proposal came up during discussions on the 2025 Finance Bill and again they used Bitcoin as an example to illustrate the tax's potential range. The purpose of the tax is to capture wealth from assets that dont contribute to economic productivity

A preliminary vote (EMPHASIS ON PRELIMINARY) on this amendment was held on November 26 where only supporting senators were in the chamber - the vote passed in this setting but it doesnt represent the final say yet. The amendment still needs to survive more legislative scrutiny before actually becoming law

If this proposal moves forward then EU is risking isolating itself as a continent unable to keep up with innovation - maybe even driving talent and capital elsewhere

Here is the amendment (its in French obviously): [https://www.senat.fr/amendements/2024-2025/143/Amdt\_I-128.html](https://www.senat.fr/amendements/2024-2025/143/Amdt_I-128.html)

https://preview.redd.it/wncswhkmin4e1.png?width=1916&format=png&auto=webp&s=99f23a0de72e5622cebfb8683d4b181601dfd3c7",313,211
Bitcoin,reddit.com,https://www.reddit.com/gallery/1h5pmuf,1h5pmuf,"In 2018 on Hitbtc i purchased many different coins, including 2000 DogeCoins and was going to get them out in 10 years. Hitbtc took them all.",2024-12-03 15:12:52.000000,https://www.reddit.com/gallery/1h5pmuf,1600,390
Bitcoin,reddit.com,https://www.reddit.com/r/CryptoCurrency/comments/1h5njti/advice_on_how_to_learn_more_about_crypto/,1h5njti,Advice on how to learn more about crypto?,2024-12-03 13:37:00.000000,"So I’ve been interested in crypto since 2016 but realize many parts of it I don’t understand. So I’ve bought a bunch of different cryptos but I recently realized I barely understand most of it. I mostly understand bitcoins use cases but I realize I don’t actually understand the technology behind it very well. Also even though I’ve owned etherium since 2018 I realize I don’t even know what a smart contract is or what its use cases are. Now we have Solana and avalanche which I believe are similar cryptos but since I don’t understand them or their actual use cases I don’t know how to pick which one I want to own.

So my main question is what books or articles or websites do you guys recommend for me to learn more about this. I want to learn enough that I understand this stuff fully. I want to be able to explain what a smart contract is and what etheriums utility is.",5,31
Bitcoin,reddit.com,https://www.reddit.com/r/CryptoCurrency/comments/1h5ng76/dotcom_bubble_20/,1h5ng76,Dot-com bubble 2.0?,2024-12-03 13:31:36.000000,"""The dot-com bubble (or dot-com boom) was a stock market bubble that ballooned during the late-1990s and peaked on Friday, March 10, 2000. This period of market growth coincided with the widespread adoption of the World Wide Web and the Internet, resulting in a dispensation of available venture capital and the rapid growth of valuations in new dot-com startups. Between 1995 and its peak in March 2000, investments in the NASDAQ composite stock market index rose by 800%, only to fall 78% from its peak by October 2002, giving up all its gains during the bubble.""

The above is from Wikipedia. Just a FYI for those who maybe not be familiar with it. 

I think because crypto is new, many coins are like  dot-com startups. 

When (/if) the bubble pops, the only coins that will be left standing will be bitcoin as a store of wealth, and coins that have established RWA. 

What are your thoughts? If you agree, what coins do you think will be here for the long run?  Like the dot-com companies that survived due to thier RWA and are now thriving.  ",0,19
Bitcoin,reddit.com,https://www.reddit.com/r/CryptoCurrency/comments/1h5l3ol/so_about_that_6m_views_crypto_documentary_going/,1h5l3ol,"So, About That 6M Views Crypto Documentary Going Around...",2024-12-03 11:13:43.000000,"Some months ago, I stumbled upon a YouTube documentary where James Jani dropped a video in 2023 calling Bitcoin and NFTs a scam. Look, I'm not gonna deny that some shady practices exist in this industry, but the documentary is seriously biased. James basically attacks Bitcoin and NFTs purely from an investment angle.

The video's got weak sources and a narrative that's super repetitive—exactly what we see in typical mass media. It's funny how ""tech influencers"" like Marques Brownlee end up backing this kind of content. It just shows how killer video editing and smooth storytelling can blow up on YouTube, even when the research is trash.

The really sad part? This video has over 6 million views. That means tons of people who know nothing about Bitcoin are getting fed this narrative.

So, if you're new to this whole crypto world, I'm gonna point you to an article I wrote on Hackernoon: [The 6M Views Crypto Documentary That Got It Wrong](https://hackernoon.com/the-6m-views-crypto-documentary-that-got-it-wrong).

My piece breaks down the holes in James's arguments. And just to be clear—I'm not trying to sell you on investing in Bitcoin or NFTs. I just want to give you a more realistic take on the industry. The article digs into blockchain technology and its actual value, instead of throwing around investment advice.

I'm totally open to discussion. Want to tear apart my perspective? Go for it. Bring your sources, and I'll be happy to hear them out.",1,1
Bitcoin,reddit.com,https://cryptobriefing.com/newsbriefs/?id=155912&title=mara-holdings-announces-700-million-note-offering-to-buy-more-bitcoin,1h5jb98,NewsBriefs - MARA Holdings announces $700 million note offering to buy more Bitcoin,2024-12-03 09:02:02.000000,https://cryptobriefing.com/newsbriefs/?id=155912&title=mara-holdings-announces-700-million-note-offering-to-buy-more-bitcoin,33,2
Bitcoin,reddit.com,https://www.bizzbuzz.news/crypto/coinswitch-brings-out-bitcoin-whitepaper-in-10-languages-1344192,1h5dqeh,Coinswitch brings out bitcoin whitepaper in 10 languages,2024-12-03 03:07:52.000000,https://www.bizzbuzz.news/crypto/coinswitch-brings-out-bitcoin-whitepaper-in-10-languages-1344192,14,9
Bitcoin,reddit.com,https://i.redd.it/jekuy5jxuj4e1.jpeg,1h5dokp,"7 Years ago - The Big Bang Theory: ""The Bitcoin Entanglement"" episode was watched by 13.84 million people (mostly adults 18–49)",2024-12-03 03:05:16.000000,https://i.redd.it/jekuy5jxuj4e1.jpeg,62,21
Bitcoin,reddit.com,https://www.reddit.com/r/CryptoCurrency/comments/1h5c9wr/rarity_of_cryptos_based_on_their_nondivisible/,1h5c9wr,Rarity of Cryptos Based on their Non-divisible Base Units.,2024-12-03 01:54:21.000000,"https://preview.redd.it/183vejcahj4e1.jpg?width=1066&format=pjpg&auto=webp&s=79950faa61c70c7d330e03ca7d0a6b5680759654

  
Cryptocurrencies transact in terms of smallest recordable units. These are their non-divisible base units, and represent the **total finite supply**. **In layman's terms: one can not send or sell 1/2 Satoshi, or any other chains coin smallest unit to another party.** 

The true rarity of a currency is based on these non-divisible base units.  The table is showing **apples** for **apples** supply in **order of rarity**, once decimal places are adjusted (blue highlighted column).",18,8
Bitcoin,reddit.com,https://www.fxleaders.com/news/2024/12/02/us-government-transfers-bitcoin-worth-2-billion-to-coinbase/,1h5bn8d,US Government Transfers Bitcoin Worth $2 billion to Coinbase,2024-12-03 01:23:01.000000,https://www.fxleaders.com/news/2024/12/02/us-government-transfers-bitcoin-worth-2-billion-to-coinbase/,1119,154
Bitcoin,reddit.com,https://decrypt.co/294449/us-spot-bitcoin-ethereum-etfs-see-record-7-6-billion-net-inflows-for-november,1h5aqql,"US Spot Bitcoin, Ethereum ETFs See Record $7.6 Billion Net Inflows For November",2024-12-03 00:40:22.000000,https://decrypt.co/294449/us-spot-bitcoin-ethereum-etfs-see-record-7-6-billion-net-inflows-for-november,37,10
Bitcoin,reddit.com,https://www.reddit.com/r/CryptoCurrency/comments/1h54mbp/nervos_to_build_layer_2_on_doge/,1h54mbp,Nervos to build Layer 2 on DOGE,2024-12-02 20:18:47.000000,"Announcing last week, Nervos is working on bringing its layer 2 protocol RGB++ to Dogecoin. With initial plans for a memecoin launchpad built on DOGE. Bringing with it the possibilities associated with DOGE now being connected to Bitcoin through RGB++

RGB++ has been receiving a lot of interest recently from both the Bitcoin and Asian crypto communities after having first being built for Bitcoin and its very novel approach of 'Isomorphic binding' which requires no actual bridge to the other chain but rather, mapping 2 chains along side each other.

**Quote from recent Techflow article:**

>It is reported that RGB++ will support the $Doge chain in the next step, and will launch the Meme launchpad on the Doge chain after the launch of BTC Meme launchpad. At the same time, he also said that the lightning network is the strategic direction of CKB's long-term layout, which will greatly increase the competitive advantage of the RGB++ protocol. It is worth noting that at present, many teams are not only focusing on the development of the protocol itself, but also promoting the compatibility of their protocols with lightning networks, such as Taproot Assets and RGB. Up to now, RGB++ ecological Meme leading coin SEAL has risen by 50% in 24 hours, and CKB has risen by 12%.

**INTRODUCTION TO RGB++**

RGB++ is an extension protocol based on RGB, utilizing single-use seals and client-side validation technology to manage state changes and transaction verification. It maps UTXOs to Nervos CKB Cells via isomorphic bindings and uses script constraints on the CKB and the other chain to verify the correctness of state computation and the validity of ownership changes.

RGB++ addresses the technical challenges faced by the original RGB protocol in practical implementation and provides more possibilities, such as blockchain-enhanced client validation, transaction folding, shared states with ownerless contracts, and non-interactive transfers. It brings Turing-complete contract extensions and performance enhancements to other UTXO chains without the need for cross-chain transfers or compromising security.

**RESOURCES**

Announcement post - [https://x.com/crypcipher/status/1860500524820496595](https://x.com/crypcipher/status/1860500524820496595)

Lead developer - [https://x.com/crypcipher](https://x.com/crypcipher)

RGB++ white paper - [https://talk.nervos.org/t/rgb-protocol-light-paper-translation/7790](https://talk.nervos.org/t/rgb-protocol-light-paper-translation/7790)

Nervos network - [https://x.com/nervosnetwork](https://x.com/nervosnetwork)

UTXO Stack - [https://x.com/UTXOStack](https://x.com/UTXOStack)

\_\_\_\_\_\_\_\_\_\_\_\_\_\_\_\_\_\_\_\_\_\_\_\_\_\_\_\_\_\_\_\_\_\_\_\_\_\_\_\_\_\_\_\_\_\_\_\_\_\_\_\_\_\_\_\_\_\_\_\_\_\_\_\_\_\_\_\_\_\_\_\_\_\_\_\_\_\_\_\_\_\_\_\_\_\_\_\_\_\_\_\_

👉 **TLDR**: Nervos network has recently announced they are working on creating a layer 2 on DOGE using their protocol RGB++ 



",1,0
Bitcoin,reddit.com,https://www.coindesk.com/markets/2024/12/02/silk-road-bitcoin-worth-nearly-2-b-moved-to-coinbase-prime,1h51cyy,Bitcoin (BTC) Price Dips as U.S. Government Moved Nearly $2B Silk Road Bitcoin,2024-12-02 18:06:46.000000,https://www.coindesk.com/markets/2024/12/02/silk-road-bitcoin-worth-nearly-2-b-moved-to-coinbase-prime,360,83
Bitcoin,reddit.com,https://decrypt.co/294277/bitcoin-miner-marathon-buys-618-million-worth-of-btc,1h4ws52,Bitcoin Miner Marathon Buys $618 Million Worth of BTC,2024-12-02 14:56:46.000000,https://decrypt.co/294277/bitcoin-miner-marathon-buys-618-million-worth-of-btc,298,30
Bitcoin,reddit.com,https://en.coinotag.com/microstrategys-recent-bitcoin-acquisitions-may-influence-corporate-investment-strategies-in-the-crypto-space/,1h4w2kv,MicroStrategy's Recent Bitcoin Acquisitions May Influence Corporate Investment Strategies in the Crypto Space,2024-12-02 14:23:39.000000,https://en.coinotag.com/microstrategys-recent-bitcoin-acquisitions-may-influence-corporate-investment-strategies-in-the-crypto-space/,25,4
Bitcoin,reddit.com,https://i.redd.it/yyg2am6zsf4e1.jpeg,1h4uxbt,"MicroStrategy has Acquired Another 15,400 BTC for $1.5 Billion. They Now hold 402,100 BTC Acquired for $23.4 Billion, Saylor quotes “The only thing better than Bitcoin is more Bitcoin”.",2024-12-02 13:27:12.000000,https://i.redd.it/yyg2am6zsf4e1.jpeg,1219,251
Bitcoin,reddit.com,https://cointelegraph.com/news/michael-saylor-tells-microsoft-it-could-grow-5-trillion-with-bitcoin?utm_source=feedly_feed&utm_medium=rss&utm_campaign=rss_partner_inbound,1h4nvun,Michael Saylor tells Microsoft it’s value could soar $5T with Bitcoin,2024-12-02 05:33:46.000000,https://cointelegraph.com/news/michael-saylor-tells-microsoft-it-could-grow-5-trillion-with-bitcoin?utm_source=feedly_feed&utm_medium=rss&utm_campaign=rss_partner_inbound,400,67
Bitcoin,reddit.com,https://www.kraken.com/barstoolcontest,1h4jbyq,"Kraken: Bitcoin Price Prediction Contest (Win 1 whole BTC, submit by Dec 13)",2024-12-02 01:28:20.000000,https://www.kraken.com/barstoolcontest,43,40
