crypto_name,source,url,id,title,published_date,summary,upvotes,comment_count
Solana,reddit.com,https://www.reddit.com/r/CryptoCurrency/comments/1gu8zop/the_meme_coin_solapocalypse_are_solanas_thousands/,1gu8zop,"The meme coin ""Solapocalypse"". Are Solana's thousands of meme coins getting setup for pump and dumps and rugpulls for 2025?",2024-11-18 16:39:29.000000,"This probably won't happen for a while, and probably will pump more before it crashes (because greed).

But these Solana meme coin could be a ticking time bomb for 2025.

# -How hard is it to make a meme coin on Solana?

Far easier than I think most people realize. Anyone can make their Solana meme coin in about 10-20 minutes.

There are dapps for token creator that makes it easy, so you don't need to have that much technical skills or know much about smart contracts. And there's sites to put them up for trading.

# -How much does it cost to make a meme coin on Solana?

It might be less than you've just spent on your current bag of Dogshitpoop coins.

It can cost from $100 to $1,000 to create the token. The main cost is gonna be marketing.

You don't need much of a cult following to make that money back.

# -How many meme coins have been made?

It's hard to keep track, there's such an insane amount of them.

On PumpFun alone, which is one of the easiest place to make a Solana meme coin, they've created new ones at an average of nearly 10,000 a day, sometimes topping at over 20,000 new meme coins a day, since last March.

https://preview.redd.it/hnwxs958so1e1.jpg?width=752&format=pjpg&auto=webp&s=9d1ba3d50da0da3599d3ea72dfd4a2d9d3ac6f78

# -What's the market cap of these meme coins?

Just the top 5 Solana meme coins have a combined market cap of $11Billion.

The top one sits at $3B right now, right below ICP and HBAR, and above Polygon and Arbitrum.

# -What is the purpose of these coins?

A few of them are legitimately for fun and for their communities, but most have only one aim: making money.

Especially the ones making claims that they're special and combining AI,  NFT art (and other buzzwords) for a meme coin revolution.

Put yourself in the shoes of a meme coin creator. The goal is to create a cult following, exploit the crypto frenzy and bullrun. Milk that as much as your greed and tolerance can handle, until you start using your cult followers as exit liquidity, and pull your major stack, hopefully before the bull cycle ends, because we're probably not gonna see most of these meme coins again.

# -What would a Solapocalypse look like?

It could be very mild, and have projects pump and dump at very different times, not affecting the market much, averting any real ""Solapocalypse"".

In an even better scenario, the majority of the big projects could have diamond hands, and we'll never have a Solapocalypse, and meme coins will simply crash when the crypto market enters its bear cycle.

Or it could turn into a panic sale, with creators rugging right after another, as they are all worried everyone is pulling out at the same time and the Solana meme coin market might be collapsing.

It might not necessarily make the crypto market crash nor end the bullmarket, but it might cause at least a brief panic and dip in the market. We've seen this many times when we have a nasty event in the middle of a bullrun, with a 30%-40% correction, then the market bounces right back and has new highs.

I could see that latter scenario happening in 2025, as it would seem just so typical of crypto.

# -Will Solana survive if there is a major ""Solapocalypse""?

Yes, it will be fine.

I really can't see a scenario where Solana would be killed off, just because of a collapse of the stupid meme coins people created on the chain.

It might have a temporary dip, and struggle briefly, but likely will bounce back.",8,22
Solana,reddit.com,https://decrypt.co/209906/solana-devs-bonk-airdrop-worth-300-last-christmas-now-worth-500000,1gthypr,Solana Devs Got a BONK Airdrop Worth $300 in 2022—It's Now Worth $1.3 Million - Decrypt,2024-11-17 16:57:20.000000,https://decrypt.co/209906/solana-devs-bonk-airdrop-worth-300-last-christmas-now-worth-500000,37,15
Solana,reddit.com,https://www.reddit.com/r/CryptoCurrency/comments/1gthl8z/a_possible_explanation_for_the_price_action_of_eth/,1gthl8z,A possible explanation for the price action of ETH,2024-11-17 16:41:09.000000,"The election of Trump shows us that people choose nowadays to follow simple stories rather than complex truths. Repeat over and over simple stories and people gather around.

The appealing story that is repeated over and over on Coindesk, CNBC, Forbes, Twitter, Reddit, YouTube is ""Solana is faster and cheaper than Ethereum and will replace this old tech"".

The Ethereum Foundation would not waste money hiring a team of communicative people to explain to journalists, economists, politicians, on YouTube, etc what Ethereum is and does. **For example** thanks to a series of past upgrades, fees in the Ethereum ecosystem have been lower than Solana's for months while the speed (number of transactions per second) has been equivalent (Solana cheats by counting protocol messages).
On the monetary side, the number of existing ETH has been decreasing since The Merge (comparable to stock buybacks) whereas SOL inflates at +5% per year.

---

PS. Why the hype around Solana is a simple story too beautiful to be true: The number of validators on Solana is very low* and so low that the operators colluded several times to halt the network, and recently to push an emergency upgrade.

The whole point of the concept of blockchain is decentralisation (meaning _impossibility to collude_), otherwise the blockchain is just a database managed by a few people, which doesn't bring any advantage. Solana is a database.

\* it is low because they are losing money, which is a unique situation (I would say a flaw) in the world of blockchains, caused by the extremely high hardware and bandwidth requirements. They lose money despite creating +5% coins per year.
Meanwhile, the number of existing ETH has been decreasing since The Merge and Ethereum validators are profitable.",113,203
Solana,reddit.com,https://www.reddit.com/r/CryptoCurrency/comments/1gta0n6/is_solana_on_the_same_trajectory_with_ethereum_in/,1gta0n6,Is Solana on the same trajectory with Ethereum in last bull run?,2024-11-17 09:31:50.000000,"I am not confident Solana will see a major spot ETF approval that could have a significant impact on its price just like we saw with BTC and Eth  but Sol seems to taking similar price pattern to Eth in last bull run.

BTC prior to its major move in 2021 retested and bettered its previous ATH in Nov/Dec 2020 while Eth was also on track to retest it ATH.. We could be seeing a similar trajectory for Solana considering its recent price action.

Sol may have the potential to replicate Eth success but I feel it need a solid fundamental to get that push just like Firedancer impact late last year. With spot ETF not likely to happen in this bull circle what could be that factor to look forward to and how high can it go in this bull run",0,7
Solana,reddit.com,https://i.redd.it/4drj2gweza1e1.jpeg,1gsszuu,"Exactly 3 Years ago, Exactly the Opposite Sentiment, Patient Ones Won",2024-11-16 18:01:59.000000,https://i.redd.it/4drj2gweza1e1.jpeg,0,4
Solana,reddit.com,https://i.redd.it/44r2fmczg91e1.png,1gsmph9,US Election Week Drives Record-Breaking 172M On-Chain Transactions - A New High in Blockchain Activity,2024-11-16 12:57:09.000000,https://i.redd.it/44r2fmczg91e1.png,118,51
Solana,reddit.com,https://cryptoslate.com/icp-identity-protocol-decideid-launches-on-solana-to-reduce-kyc-need-for-defi/,1gseuhh,ICP identity protocol to launch on Solana eliminating any KYC need for DeFi,2024-11-16 03:52:46.000000,https://cryptoslate.com/icp-identity-protocol-decideid-launches-on-solana-to-reduce-kyc-need-for-defi/,0,4
Solana,reddit.com,https://cointelegraph.com/news/odds-favor-solana-etf-2025-van-eck,1gse1yn,Odds favor Solana ETF in 2025: VanEck,2024-11-16 03:08:32.000000,https://cointelegraph.com/news/odds-favor-solana-etf-2025-van-eck,0,4
Solana,reddit.com,https://www.theblock.co/post/325570/solana-powers-89-of-new-token-launches-as-memecoin-craze-continues-to-fuel-network-activity,1grt4gv,Solana powers 89% of new token launches as memecoin craze continues to fuel network activity,2024-11-15 10:05:59.000000,https://www.theblock.co/post/325570/solana-powers-89-of-new-token-launches-as-memecoin-craze-continues-to-fuel-network-activity,0,42
Solana,reddit.com,https://www.reddit.com/r/CryptoCurrency/comments/1gre6g8/last_stables_to_deploy/,1gre6g8,Last stables to deploy,2024-11-14 20:19:08.000000,"
Any suggestions? Only top 50 cryptos I guess. 

So, I’ve been here since 2017 and before this bull I’ve been deployed for pretty long now. But I got some cash left from selling stocks and want to deploy this heavily into one or two stable cryptos. Solana is very high and I have plenty already. Same with SUI. I still like ADA and XRP actually and I have enough of that already. Same regarding ETH which I don’t really like anymore. I’m thinking about AVAX and not sure about any other. 

Any suggestions? Only top 50 cryptos I guess. ",0,18
Solana,reddit.com,https://www.reddit.com/r/CryptoCurrency/comments/1gr4dnm/thoughts_on_dino_coins_this_cycle/,1gr4dnm,"Thoughts on ""Dino coins"" this cycle? ",2024-11-14 13:08:25.000000,"Is there any real hope left for the so-called 'dino coins' this bull cycle, or are they a lost cause? Not looking to mention specifics, but I'm talking about those projects with solid tech, active dev teams, real use cases, yet somehow they’re overshadowed by the glitzy new wave of Solana memecoins and flashier projects. With all the hype around the ‘next big thing,’ it feels like my portfolio is being left in the dust, and I’m seriously starting to wonder if I’ll see any green this cycle. Is it just early days, or am I in denial? Share some hopium if you've got it—really curious to know what you guys think!

P.S.: One thing that worries me is that all those folks holding these are just looking to exit so they will never do well... but on the other hand I'm sure there were many bagholders from 2017 yet some of these projects still did amazing in 2021.  What gives?",0,13
Solana,reddit.com,https://dailycoin.com/doj-to-seize-16m-in-ftx-bribes-mostly-in-solana/?utm_source=cryptopanic&utm_medium=rss,1gqkbas,"DOJ to Seize $16M in FTX Bribes, Mostly in Solana",2024-11-13 18:50:21.000000,https://dailycoin.com/doj-to-seize-16m-in-ftx-bribes-mostly-in-solana/?utm_source=cryptopanic&utm_medium=rss,45,20
Solana,reddit.com,https://www.reddit.com/r/CryptoCurrency/comments/1gqk95e/solana_would_you_or_would_you_not_investment/,1gqk95e,SOLANA. Would you? Or would you not? Investment advice needed… ,2024-11-13 18:47:50.000000,"Hi all, would you invest money in Solana? I am not entirely sure about the investment, as the market can be very unpredictable. Some people assume that Solana might develop similarly to Ethereum and, as a result, could increase significantly in value over time. I am aware that no one can predict these things exactly, especially in the world of cryptocurrencies, but I’d love to hear your thoughts on it.

Do you believe Solana has strong long-term potential? Or do you think other projects might be safer or more promising? Maybe there’s something else you’d recommend looking into, given the rapid changes in the crypto landscape. I’d be interested to know if there’s a particular reason to consider Solana over other altcoins, or if it’s better to diversify across different assets.",0,27
Solana,reddit.com,https://newsroom.aboutrobinhood.com/robinhood-crypto-expands-offering-with-solana-sol-pepe-pepe-cardano-ada-amp-xrp-xrp-for-u-s-customers/,1gqe1im,"Robinhood Crypto Expands Offering with Solana (SOL), Pepe (PEPE), Cardano (ADA) & XRP (XRP) for U.S. Customers",2024-11-13 14:25:46.000000,https://newsroom.aboutrobinhood.com/robinhood-crypto-expands-offering-with-solana-sol-pepe-pepe-cardano-ada-amp-xrp-xrp-for-u-s-customers/,101,40
Solana,reddit.com,https://beincrypto.com/us-to-recover-sam-bankman-fried-china-bribery-account/,1gq3n4w,US Seeks to Seize Crypto Account Linked to Sam Bankman-Fried’s China Bribe,2024-11-13 03:25:21.000000,https://beincrypto.com/us-to-recover-sam-bankman-fried-china-bribery-account/,7,3
Solana,reddit.com,https://www.reddit.com/r/CryptoCurrency/comments/1gporp0/were_entering_the_phase_where_things_start/,1gporp0,"We're entering the phase where things start pumping, but not always with rhyme or reason. Don't always try to find logic in what should pump more and what shouldn't.  ",2024-11-12 16:31:30.000000,"Everything is gonna pump, but not always what you think should pump the most. It's not always gonna follow tech.

It's not always gonna be about what project could solve the trilemma better, what is more decentralized, what has better smart contracts, etc...

# -The most significant factor as we get deeper into a bullrun will be hype and trend, the more the market gets emotional.

We're gonna see some great projects not get much love, and some flawed ones or even meme or shitcoins get more hype.

Bullruns are emotional and work more like Instagram trends than on technical merit. The deeper we get into them, the less they have rhyme or reason. 

# -Don't fight the trend.

Trends are your friend. Once they carry momentum, it's hard for them to stop.

When the market has its mind set on a narrative or a trend, it's hard to undo that.

# -There are times where tech and hype can overlap, if the narrative is right.

In the short run, when you're speculating on just a bullrun, better tech only works if there's some hot hype to go with it. Some bell and whistles, or something that can be marketed easily about that tech that will still catch the interest of the average person who is clueless about tech.

We've seen in past runs how tech like ALGO that was hyped as carbon neutral, Solana for its incredible speed, ADA as based on science, MATIC as something that can make Ethereum faster and cheaper, and many chains like AVAX hyped as ""Ethereum killers"", had simple digestible concepts to hype them.

Which is not to say that the hype didn't come from actual merit, but from something easily sellable to an average person.

# ",46,41
Solana,reddit.com,https://cryptopotato.com/what-the-fud-ethereum-adds-solanas-entire-market-cap-in-1-week-etfs-see-record-inflow/,1gpjuwa,"What The FUD? Ethereum Adds Solana’s Entire Market Cap in 1 Week, ETFs See Record Inflow",2024-11-12 12:43:48.000000,https://cryptopotato.com/what-the-fud-ethereum-adds-solanas-entire-market-cap-in-1-week-etfs-see-record-inflow/,297,101
Solana,reddit.com,https://www.reddit.com/r/CryptoCurrency/comments/1goyqnm/warning_crypto_scams_are_on_the_rise_scammers_can/,1goyqnm,"WARNING: Crypto Scams are on the rise. Scammers can and do promote their projects through official market entities (Youtube, Instagram, etc...) or social engineering (Reddit Chats, Emails, Unsolicited Calls).",2024-11-11 18:07:40.000000,"When Crypto is hot and amateurs start flocking to the market, you will see an influx of scammers trying to steal their money. Please be aware of some of the most popular Scams:

# Youtube ads, most commonly about ""doubling your money"".

I have gotten tons of these on my mobile device in the past two weeks. Usually regarding XRP or Solana ""Giving back to the community"" - Send us your funds and we'll send you back double. It's literally a doubling money scam with a new face.

# MEV Bot Scams

This one gets advertised a lot on Youtube as well. Idea is to download a trading bot that will allow you to make money passively by sandwiching users with high Slippage. However you download the bot and then get drained, **seriously if you ever see something about this it's a scam, DO NOT DOWNLOAD IT**. Nobody with a good sandwich bot will give it to you, or they would lose potential income from that bot by allowing other users to trade it.

# Stupidly high APR (commonly advertised on Instagram)

This one is targeted at greedy amateurs and offer stupidly high APR like 2-3% per day for staking ETH. However it's a scam and when you set it up they just drain your wallet.

# Reddit Chat Scams

Seriously if you get chat requests on Reddit about Crypto they're a scammer:

https://preview.redd.it/o5j45uaxab0e1.png?width=366&format=png&auto=webp&s=9aa73ec3327ccbd9ba4daabba72fab5fd78d0daf

# Fake Exchange Email and Phone Call Scams

This one is just pure social engineering. Sending an Email or Phone Call pretending to be an exchange saying something is urgently wrong and trying to get you to provide 2fa information for the scammer to access your exchange account and drain you.

# Classic Pig Butchering

A long term scam where someone messages you in an unsolicited way then works to build report with the idea that you eventually invest in a Scam Crypto Exchange. This one never stopped and you should be aware of it, but the other scams above are on the uptick.",72,21
Solana,reddit.com,https://www.coindesk.com/markets/2024/11/10/solana-joins-100b-club-hitting-nearly-a-three-year-high-above-210/?utm_medium=referral&utm_source=rss&utm_campaign=headlines,1go81yx,"Solana Joins $100B Club, Hitting Nearly a Three-Year High Above $210",2024-11-10 19:02:39.000000,https://www.coindesk.com/markets/2024/11/10/solana-joins-100b-club-hitting-nearly-a-three-year-high-above-210/?utm_medium=referral&utm_source=rss&utm_campaign=headlines,107,31
Solana,reddit.com,https://cointelegraph.com/news/edward-snowden-redacted-event-decentralization-solana,1go1d34,"Snowden calls for decentralization, criticizes VC influence on Solana",2024-11-10 14:05:16.000000,https://cointelegraph.com/news/edward-snowden-redacted-event-decentralization-solana,89,20
Solana,reddit.com,https://statusgator.com/services/solana,1gnlpv9,Solana is having network issues. ,2024-11-09 22:27:09.000000,https://statusgator.com/services/solana,332,162
Solana,reddit.com,https://www.newsbtc.com/news/solana/194-breakout-in-sight-for-solana/,1gm2rqx,Solana Bulls Aim High: $194 Breakout In Sight Amid Market Optimism,2024-11-07 22:15:22.000000,https://www.newsbtc.com/news/solana/194-breakout-in-sight-for-solana/,0,4
Solana,reddit.com,https://www.coindesk.com/markets/2024/11/06/solana-jumps-17-flips-bnb-chain-token-as-trumps-lead-renews-etf-hopes/?utm_content=editorial&utm_medium=social&utm_source=telegram&utm_term=organic&utm_campaign=news,1gktppr,"Solana Jumps 17%, Flips BNB, Binance Chain Token",2024-11-06 08:19:49.000000,https://www.coindesk.com/markets/2024/11/06/solana-jumps-17-flips-bnb-chain-token-as-trumps-lead-renews-etf-hopes/?utm_content=editorial&utm_medium=social&utm_source=telegram&utm_term=organic&utm_campaign=news,50,41
Solana,reddit.com,https://www.newsbtc.com/altcoin/solana-rises-1400-despite-jim-cramers-idiot-criticism/,1gih8c3,"Solana Rises 1,400% Despite Jim Cramer's 'Idiot' Criticism",2024-11-03 07:00:19.000000,https://www.newsbtc.com/altcoin/solana-rises-1400-despite-jim-cramers-idiot-criticism/,0,6
Solana,reddit.com,https://cointelegraph.com/news/solana-price-hits-3-month-high-as-data-hints-at-sol-rally-above-200?utm_source=feedly_feed&utm_medium=rss&utm_campaign=rss_partner_inbound,1gf4snj,Solana price hits 3-month high as data hints at SOL rally above $200,2024-10-29 20:36:18.000000,https://cointelegraph.com/news/solana-price-hits-3-month-high-as-data-hints-at-sol-rally-above-200?utm_source=feedly_feed&utm_medium=rss&utm_campaign=rss_partner_inbound,0,9
Solana,reddit.com,https://www.reddit.com/r/CryptoCurrency/comments/1gdzn8x/hello_rcc_hege_will_be_sponsoring_the_subreddit/,1gdzn8x,"Hello r/CC! $HEGE will be sponsoring the subreddit over the next 3 days - banner, AMA and giveaway!",2024-10-28 11:26:03.000000,"https://preview.redd.it/ldh7g60sehxd1.jpg?width=2125&format=pjpg&auto=webp&s=2e70a28031450a08d1c29986fdc0a64a6012be78

# [Here at $HEGE](https://www.reddit.com/r/HegeCoin/) we're well aware of the stigma around memecoins, so we'd like to answer your questions. 

# In a sea of scams on the Solana blockchain, we aim to provide a secure and trusted environment for our holders.

Hege Coin was launched by a developer (myself) that got rug pulled A LOT. Fed up with this, I decided to create my own project. Working as a graphic and brand designer, I had the creative skills needed to start a project, and some knowledge of the Solana ecosystem.

I initially had many questions on how to successfully launch a coin and turned to Reddit, specifically , looking for advice. The post received a huge response and sparked a lot of interest. After a few weeks of presale and countless tweaks to the characters, website and tokenomics, we launched. $2M market cap on night one, a sharp drop the following day and an organic rise to an all time high of $31M a few months later, it’s been quite the journey!

**Hege is a Solana memecoin, with a unique twist...**  
Hege is a hedgehog with a quest to impress his crush Hegena. We've gamified the token by creating 10 chapters to his story, every chapter is released at various market cap levels, with chapter 10 being released at a $1 billion market cap. The production value has increased with each milestone, with the upcoming chapter 5 (unlocked at $50M) taking over a month to animate.

**Why has Hege been successful?**  
An engaging narrative and widespread appeal has been the key. We have built a brand that includes a cast of relatable characters and a story that is easy to connect with. The Hege story features 4 characters, Hege, Hegena, Hendrix and Helena. These characters are all built around stereotypes we see everyday in modern society, creating a story that is relatable and easily memeable.

The project has attracted a talented team and creative community that has been creating Hege content and helping spread the word since day 1. We currently have 12,800 holders, 6,200 members on Telegram, 22.2K followers on X, 8K subscribers on Youtube, over 1K followers over Instagram/Facebook and almost 500 images/videos in our meme folder.

**Born on Reddit, thriving on Reddit**  
It all started here on Reddit with a single post on the Solana subreddit , and since then Reddit has remained our most successful promotional platform. We've been labelled the 'King of Reddit' in the memecoin space multiple times, as a large percentage of our community have discovered us here. We're aware Reddit is the first place many new memecoin investors go, therefore investing in Hege means you're betting on the fact that retail will come flooding into Reddit as the bull run really starts to accelerate.

**An NFT Collection (with utility)**  
Last month, we launched[ Hegends](https://app.hegecoin.com/), a collection of 2,222 NFTs that pay a dividend to its holders. The public mint sold out in 90 minutes, and they are now trading on Tensor & Magic Eden. From the mint proceeds, we raised over $200,000 that will ALL be invested back into the project in one way or another. Whether that's buybacks, marketing funds, CEX listing fees or investments in further utility, it will ALL stay in the Hege ecosystem.

The NFTs feature a utility where every month, 5% of Hege tokens in the mint wallet will be distributed amongst NFT holders. Each NFT held will entitle a holder to distribution from the bank, and the collection features 5 rarity levels that multiply the amount of $HEGE tokens you receive, ranging from 1X for common NFT holders, all the way up to 10X for legendary NFT holders.

For more information on Hege, check out our website: [hegecoin.com](http://hegecoin.com)

**Giveaway**  
Enough of the talk about ourselves. We'd like to celebrate Hege making an appearance on r/CryptoCurrency, we’re giving away **a total of $1000 to the best 5 questions asked below!** You must also follow the r/HegeCoin subreddit to be in with a chance of winning. Winners will be asked for a Solana wallet address via DM on **November 2nd 2024**.

**AMA**  
Hege is a memecoin with no flashy tech, promises of changing the world or the way we transact, but we're honest about what we're doing and what we aim to achieve.

We think that memecoins are one of the best ways to bring awareness to Cryptocurrency, so we're wondering if you have objections to memecoins, what are they?",9,815
Solana,reddit.com,https://cointelegraph.com/news/total-economic-activity-solana-all-time-high?utm_source=feedly_feed&utm_medium=rss&utm_campaign=rss_partner_inbound,1gbc716,Solana again clocks record-breaking fee revenue,2024-10-24 20:14:38.000000,https://cointelegraph.com/news/total-economic-activity-solana-all-time-high?utm_source=feedly_feed&utm_medium=rss&utm_campaign=rss_partner_inbound,0,10
Solana,reddit.com,https://www.coindesk.com/markets/2024/10/24/solana-looks-overbought-against-ethereum-btc-gold-ratio-stuck-in-a-downtrend/?utm_content=editorial&utm_medium=social&utm_source=telegram&utm_term=organic&utm_campaign=news,1gb0r2c,Solana Looks Overbought Against Ethereum.,2024-10-24 11:50:38.000000,https://www.coindesk.com/markets/2024/10/24/solana-looks-overbought-against-ethereum-btc-gold-ratio-stuck-in-a-downtrend/?utm_content=editorial&utm_medium=social&utm_source=telegram&utm_term=organic&utm_campaign=news,239,218
Solana,reddit.com,https://www.bitcoinsensus.com/news/vaneck-launches-staking-for-solana-etn-in-europe/,1gabfhm,VanEck Launches Staking for Solana ETN in Europe,2024-10-23 14:07:22.000000,https://www.bitcoinsensus.com/news/vaneck-launches-staking-for-solana-etn-in-europe/,0,4
Solana,reddit.com,https://cryptobriefing.com/solana-tvl-surge-analysis/,1g9kjze,Solana TVL reaches new peak since early 2022,2024-10-22 15:13:49.000000,https://cryptobriefing.com/solana-tvl-surge-analysis/,0,24
